country,city,hotel_name,hotel_address
Netherlands,Amsterdam,Amadi Panorama Hotel,Ijburglaan 539 Zeeburg 1087 BE Amsterdam Netherlands
Netherlands,Amsterdam,Amadi Park Hotel,Eerste Constantijn huygensstraat 26G Oud West 1054 BR Amsterdam Netherlands
Netherlands,Amsterdam,Ambassade Hotel,Herengracht 341 Amsterdam City Center 1016 AZ Amsterdam Netherlands
Netherlands,Amsterdam,Amsterdam Marriott Hotel,Stadhouderskade 12 Oud West 1054 ES Amsterdam Netherlands
Netherlands,Amsterdam,Apollo Hotel Amsterdam,Apollolaan 2 Oud Zuid 1077 BA Amsterdam Netherlands
Netherlands,Amsterdam,Banks Mansion All Inclusive Hotel,Herengracht 519 525 Amsterdam City Center 1017 BV Amsterdam Netherlands
Netherlands,Amsterdam,Best Western Blue Tower Hotel,Leeuwendalersweg 21 Bos en Lommer 1055 JE Amsterdam Netherlands
Netherlands,Amsterdam,Best Western Delphi Hotel,Apollolaan 101 105 Oud Zuid 1077 AN Amsterdam Netherlands
Netherlands,Amsterdam,Best Western Plus Hotel Blue Square,Slotermeerlaan 80 Geuzenveld Slotermeer 1064 HD Amsterdam Netherlands
Netherlands,Amsterdam,Best Western Premier Hotel Couture,Delflandlaan 15 Slotervaart 1062 EA Amsterdam Netherlands
Netherlands,Amsterdam,Bilderberg Garden Hotel,Dijsselhofplantsoen 7 Oud Zuid 1077 BJ Amsterdam Netherlands
Netherlands,Amsterdam,Bilderberg Hotel Jan Luyken,Jan Luykenstraat 58 Oud Zuid 1071 CS Amsterdam Netherlands
Netherlands,Amsterdam,Boutique Hotel Notting Hill,Westeinde 26 Amsterdam City Center 1017 ZP Amsterdam Netherlands
Netherlands,Amsterdam,Chasse Hotel,Chassestraat 62 64 De Baarsjes 1057 JJ Amsterdam Netherlands
Netherlands,Amsterdam,Conservatorium Hotel,Van Baerlestraat 27 Oud Zuid 1071 AN Amsterdam Netherlands
Netherlands,Amsterdam,Corendon Vitality Hotel Amsterdam,Aletta Jacobslaan 7 Slotervaart 1066 BP Amsterdam Netherlands
Netherlands,Amsterdam,Courtyard by Marriott Amsterdam Arena Atlas,Hoogoorddreef 1 Zuidoost 1101 BA Amsterdam Netherlands
Netherlands,Amsterdam,Crowne Plaza Amsterdam South,George Gershwinlaan 101 Zuideramstel 1082 MT Amsterdam Netherlands
Netherlands,Amsterdam,De L Europe Amsterdam,Nieuwe Doelenstraat 2 14 Amsterdam City Center 1012 CP Amsterdam Netherlands
Netherlands,Amsterdam,Dikker en Thijs Fenice Hotel,Prinsengracht 444 Amsterdam City Center 1017 KE Amsterdam Netherlands
Netherlands,Amsterdam,DoubleTree by Hilton Amsterdam Centraal Station,Oosterdoksstraat 4 Amsterdam City Center 1011 DK Amsterdam Netherlands
Netherlands,Amsterdam,DoubleTree by Hilton Hotel Amsterdam NDSM Wharf,Ndsm Plein 28 Amsterdam Noord 1033 WB Amsterdam Netherlands
Netherlands,Amsterdam,Dutch Design Hotel Artemis,John M Keynesplein 2 Slotervaart 1066 EP Amsterdam Netherlands
Netherlands,Amsterdam,Element Amsterdam,Arend Janszoon Ernststraat 577 Zuideramstel 1082 LD Amsterdam Netherlands
Netherlands,Amsterdam,Fletcher Hotel Amsterdam,Schepenbergweg 50 Zuidoost 1105 AT Amsterdam Netherlands
Netherlands,Amsterdam,Golden Tulip Amsterdam Riverside,Provincialeweg 38 Zuidoost 1108 AB Amsterdam Netherlands
Netherlands,Amsterdam,Golden Tulip Amsterdam West,Molenwerf 1 1014 AG Amsterdam Netherlands
Netherlands,Amsterdam,Grand Hotel Amr th Amsterdam,Prins Hendrikkade 108 Amsterdam City Center 1011 AK Amsterdam Netherlands
Netherlands,Amsterdam,Grand Hotel Downtown,Eerste Constantijn Huygensstraat 10A Oud West 1054 BR Amsterdam Netherlands
Netherlands,Amsterdam,Hampshire Hotel Amsterdam American,Leidsekade 97 Amsterdam City Center 1017 PN Amsterdam Netherlands
Netherlands,Amsterdam,Hampshire Hotel Rembrandt Square Amsterdam,Amstelstraat 17 Amsterdam City Center 1017 DA Amsterdam Netherlands
Netherlands,Amsterdam,Hampshire Hotel The Manor Amsterdam,Linnaeusstraat 89 Oost 1093 EK Amsterdam Netherlands
Netherlands,Amsterdam,Hampton by Hilton Amsterdam Centre East,Panama Laan 188 196 Zeeburg 1019 AZ Amsterdam Netherlands
Netherlands,Amsterdam,Hilton Amsterdam,Apollolaan 138 Oud Zuid 1077 BG Amsterdam Netherlands
Netherlands,Amsterdam,Holiday Inn Amsterdam,De Boelelaan 2 Zuideramstel 1083 HJ Amsterdam Netherlands
Netherlands,Amsterdam,Holiday Inn Amsterdam Arena Towers,Hoogoorddreef 66 Zuidoost 1101 BE Amsterdam Netherlands
Netherlands,Amsterdam,Hotel Arena, s Gravesandestraat 55 Oost 1092 AA Amsterdam Netherlands
Netherlands,Amsterdam,Hotel Esther a,Singel 303 309 Amsterdam City Center 1012 WJ Amsterdam Netherlands
Netherlands,Amsterdam,Hotel JL No76,Jan Luijkenstraat 76 Oud Zuid 1071 CT Amsterdam Netherlands
Netherlands,Amsterdam,Hotel Okura Amsterdam,Ferdinand Bolstraat 333 Oud Zuid 1072 LH Amsterdam Netherlands
Netherlands,Amsterdam,Hotel Roemer Amsterdam,Roemer Visscherstraat 8 10 Oud West 1054 EV Amsterdam Netherlands
Netherlands,Amsterdam,Hotel V Nesplein,Nes 49 Amsterdam City Center 1012 KD Amsterdam Netherlands
Netherlands,Amsterdam,Hotel Vondel Amsterdam,Vondelstraat 18 30 Oud West 1054 GE Amsterdam Netherlands
Netherlands,Amsterdam,INK Hotel Amsterdam MGallery by Sofitel,Nieuwezijds Voorburgwal 67 Amsterdam City Center 1012 RE Amsterdam Netherlands
Netherlands,Amsterdam,Inntel Hotels Amsterdam Centre,Nieuwezijdskolk 19 Amsterdam City Center 1012 PV Amsterdam Netherlands
Netherlands,Amsterdam,Jaz Amsterdam,De Passage 90 Noord Holland Zuidoost 1101 AX Amsterdam Netherlands
Netherlands,Amsterdam,Luxury Suites Amsterdam,Oudeschans 75 Amsterdam City Center 1011 KW Amsterdam Netherlands
Netherlands,Amsterdam,M venpick Hotel Amsterdam City Centre,Piet Heinkade 11 Zeeburg 1019 BR Amsterdam Netherlands
Netherlands,Amsterdam,Mercure Amsterdam Sloterdijk Station,Naritaweg 1 Westpoort 1043 BP Amsterdam Netherlands
Netherlands,Amsterdam,Mercure Hotel Amsterdam City South,Joan Muyskenweg 10 Oost 1096 CJ Amsterdam Netherlands
Netherlands,Amsterdam,Mercure Hotel Amsterdam West,Oude Haagseweg 20 Slotervaart 1066 BW Amsterdam Netherlands
Netherlands,Amsterdam,NH Amsterdam Caransa,Rembrandtplein 19 Amsterdam City Center 1017 CT Amsterdam Netherlands
Netherlands,Amsterdam,NH Amsterdam Museum Quarter,Hobbemakade 50 Oud Zuid 1071 XL Amsterdam Netherlands
Netherlands,Amsterdam,NH Amsterdam Schiller,Rembrandtplein 26 36 Amsterdam City Center 1017 CV Amsterdam Netherlands
Netherlands,Amsterdam,NH Amsterdam Zuid,Van Leijenberghlaan 221 Zuideramstel 1082 GG Amsterdam Netherlands
Netherlands,Amsterdam,NH Carlton Amsterdam,Vijzelstraat 4 Amsterdam City Center 1017 HK Amsterdam Netherlands
Netherlands,Amsterdam,NH City Centre Amsterdam,Spuistraat 288 292 Amsterdam City Center 1012 VX Amsterdam Netherlands
Netherlands,Amsterdam,NH Collection Amsterdam Barbizon Palace,Prins Hendrikkade 59 72 Amsterdam City Center 1012 AD Amsterdam Netherlands
Netherlands,Amsterdam,NH Collection Amsterdam Doelen,Nieuwe Doelenstraat 24 Amsterdam City Center 1012 CP Amsterdam Netherlands
Netherlands,Amsterdam,NH Collection Amsterdam Grand Hotel Krasnapolsky,Dam 9 Amsterdam City Center 1012 JS Amsterdam Netherlands
Netherlands,Amsterdam,Novotel Amsterdam City,Europaboulevard 10 Zuideramstel 1083 AD Amsterdam Netherlands
Netherlands,Amsterdam,Ozo Hotel,Karspeldreef 2 Zuidoost 1101 CJ Amsterdam Netherlands
Netherlands,Amsterdam,Park Hotel,Stadhouderskade 25 Oud Zuid 1071 ZD Amsterdam Netherlands
Netherlands,Amsterdam,Park Plaza Victoria Amsterdam,Damrak 1 5 Amsterdam City Center 1012 LG Amsterdam Netherlands
Netherlands,Amsterdam,Park Plaza Vondelpark Amsterdam,Koninginneweg 34 36 Oud Zuid 1075 CZ Amsterdam Netherlands
Netherlands,Amsterdam,Pillows Anna van den Vondel Amsterdam,Anna van den Vondelstraat 6 Oud West 1054 GZ Amsterdam Netherlands
Netherlands,Amsterdam,Pulitzer Amsterdam,Prinsengracht 315 331 Amsterdam City Center 1016 GZ Amsterdam Netherlands
Netherlands,Amsterdam,Radisson Blu Hotel Amsterdam,Rusland 17 Amsterdam City Center 1012 CK Amsterdam Netherlands
Netherlands,Amsterdam,Ramada Apollo Amsterdam Centre,Staalmeesterslaan 410 Slotervaart 1057 PH Amsterdam Netherlands
Netherlands,Amsterdam,Renaissance Amsterdam Hotel,Kattengat 1 Amsterdam City Center 1012 SZ Amsterdam Netherlands
Netherlands,Amsterdam,Room Mate Aitana,IJdock 6 Amsterdam City Center 1013 MM Amsterdam Netherlands
Netherlands,Amsterdam,Savoy Hotel Amsterdam,Ferdinand Bolstraat 194 Oud Zuid 1072 LW Amsterdam Netherlands
Netherlands,Amsterdam,Sir Albert Hotel,Albert Cuypstraat 2 6 Oud Zuid 1072 CT Amsterdam Netherlands
Netherlands,Amsterdam,Sofitel Legend The Grand Amsterdam,Oudezijds Voorburgwal 197 Amsterdam City Center 1012 EX Amsterdam Netherlands
Netherlands,Amsterdam,Swiss tel Amsterdam,Damrak 96 Amsterdam City Center 1012 LP Amsterdam Netherlands
Netherlands,Amsterdam,The Hoxton Amsterdam,Herengracht 255 Amsterdam City Center 1016 BJ Amsterdam Netherlands
Netherlands,Amsterdam,The Student Hotel Amsterdam City,Wibautstraat 129 Oost 1091 GL Amsterdam Netherlands
Netherlands,Amsterdam,The Toren,Keizersgracht 164 Amsterdam City Center 1015 CZ Amsterdam Netherlands
Netherlands,Amsterdam,Urban Lodge Hotel,Arlandaweg 10 Westpoort 1043 EW Amsterdam Netherlands
Netherlands,Amsterdam,WestCord Art Hotel Amsterdam 4 stars,Spaarndammerdijk 304 Westerpark 1013 ZX Amsterdam Netherlands
Netherlands,Amsterdam,WestCord Fashion Hotel Amsterdam,Hendrikje Stoffelstraat 1 Slotervaart 1058 GC Amsterdam Netherlands
Netherlands,Amsterdam,art otel Amsterdam,Prins Hendrikkade 33 Amsterdam City Center 1012 TM Amsterdam Netherlands
Netherlands,Amsterdam,citizenM Amsterdam,Prinses Irenestraat 30 Zuideramstel 1077 WX Amsterdam Netherlands
France,Paris,1K Hotel,13 Boulevard Du Temple 3rd arr 75003 Paris France
France,Paris,AC Hotel Paris Porte Maillot by Marriott,6 rue Gustave Charpentier 17th arr 75017 Paris France
France,Paris,Acad mie H tel Saint Germain,32 rue des Saints P res 7th arr 75007 Paris France
France,Paris,Amarante Beau Manoir,6 Rue de l Arcade 8th arr 75008 Paris France
France,Paris,Amarante Champs Elys es,19 Rue Vernet 8th arr 75008 Paris France
France,Paris,Amp re,102 Avenue de Villiers 17th arr 75017 Paris France
France,Paris,Artus Hotel by MH,34 Rue de Buci 6th arr 75006 Paris France
France,Paris,Atala Champs Elys es,10 rue Chateaubriand 8th arr 75008 Paris France
France,Paris,Au Manoir Saint Germain,153 Boulevard Saint Germain 6th arr 75006 Paris France
France,Paris,Auteuil Tour Eiffel,8 10 Rue F licien David 16th arr 75016 Paris France
France,Paris,Balmoral Champs Elys es,6 rue du General Lanrezac 17th arr 75017 Paris France
France,Paris,Banke H tel,20 Rue La Fayette 9th arr 75009 Paris France
France,Paris,Bassano,15 Rue de Bassano 16th arr 75016 Paris France
France,Paris,Belfast,10 avenue Carnot 17th arr 75017 Paris France
France,Paris,Best Western Allegro Nation,33 Avenue Du Docteur Arnold Netter 12th arr 75012 Paris France
France,Paris,Best Western Amiral Hotel,98 Avenue d Italie 13th arr 75013 Paris France
France,Paris,Best Western Bretagne Montparnasse,33 rue Raymond Losserand 14th arr 75014 Paris France
France,Paris,Best Western Ducs de Bourgogne,19 Rue Du Pont Neuf 1st arr 75001 Paris France
France,Paris,Best Western Le Jardin de Cluny,9 Rue du Sommerard 5th arr 75005 Paris France
France,Paris,Best Western Mercedes Arc de Triomphe,128 avenue de Wagram 17th arr 75017 Paris France
France,Paris,Best Western Nouvel Orl ans Montparnasse,25 avenue du General Leclerc 14th arr 75014 Paris France
France,Paris,Best Western Op ra Batignolles,165 rue de Rome 17th arr 75017 Paris France
France,Paris,Best Western Paris Gare Saint Lazare,18 rue de Constantinople 8th arr 75008 Paris France
France,Paris,Best Western Premier Kapital Op ra,34 rue de Moscou 8th arr 75008 Paris France
France,Paris,Best Western Premier Le Swann,15 rue de Constantinople 8th arr 75008 Paris France
France,Paris,Best Western Premier Marais Grands Boulevards,112 boulevard de S bastopol 3rd arr 75003 Paris France
France,Paris,Best Western Premier Op ra Faubourg Ex Hotel Jules ,49 Rue La Fayette 9th arr 75009 Paris France
France,Paris,Best Western Premier Op ra Opal,19 Rue Tronchet 8th arr 75008 Paris France
France,Paris,Best Western S vres Montparnasse,153 Rue De Vaugirard 15th arr 75015 Paris France
France,Paris,Buddha Bar Hotel Paris,4 rue d Anjou 8th arr 75008 Paris France
France,Paris,COQ Hotel Paris,15 rue Edouard Manet 13th arr 75013 Paris France
France,Paris,Castille Paris Starhotels Collezione,33 Rue Cambon 1st arr 75001 Paris France
France,Paris,Chambiges Elys es,8 rue Chambiges 8th arr 75008 Paris France
France,Paris,Chateau Frontenac,54 rue Pierre Charron 8th arr 75008 Paris France
France,Paris,Crowne Plaza Paris R publique,10 Place De La R publique 11th arr 75011 Paris France
France,Paris,D clic Hotel,17 rue Duhesme 18th arr 75018 Paris France
France,Paris,Drawing Hotel,17 rue de Richelieu 1st arr 75001 Paris France
France,Paris,Duret,30 Rue Duret 16th arr 75016 Paris France
France,Paris,Edouard 7 Paris Op ra,39 Avenue de l Op ra 2nd arr 75002 Paris France
France,Paris,Eiffel Trocad ro,35 Rue Benjamin Franklin 16th arr 75016 Paris France
France,Paris,Elys es R gencia,41 Avenue Marceau 16th arr 75016 Paris France
France,Paris,Forest Hill Paris la Villette,28 av Corentin Cariou 19th arr 75019 Paris France
France,Paris,Four Seasons Hotel George V Paris,31 Avenue George V 8th arr 75008 Paris France
France,Paris,Francois 1er,7 Rue Magellan 8th arr 75008 Paris France
France,Paris,Franklin Roosevelt,18 rue Clement Marrot 8th arr 75008 Paris France
France,Paris,Gardette Park Hotel,1 Rue Du G n ral Blaise 11th arr 75011 Paris France
France,Paris,Golden Tulip Bercy Gare de Lyon 209,209 211 rue de Charenton 12th arr 75012 Paris France
France,Paris,Golden Tulip Opera de Noailles,9 rue de la Michodi re 2nd arr 75002 Paris France
France,Paris,Grand Pigalle Hotel,29 rue Victor Mass 9th arr 75009 Paris France
France,Paris,H tel Ad le Jules,2 4bis Cit Rougemont 9th arr 75009 Paris France
France,Paris,H tel Aiglon Esprit de France,232 Boulevard Raspail 14th arr 75014 Paris France
France,Paris,H tel Amastan Paris,34 rue Jean Mermoz 8th arr 75008 Paris France
France,Paris,H tel Arvor Saint Georges,8 rue Laferriere 9th arr 75009 Paris France
France,Paris,H tel Beauchamps,24 rue de Ponthieu 8th arr 75008 Paris France
France,Paris,H tel Bedford,17 rue de l Arcade 8th arr 75008 Paris France
France,Paris,H tel Bel Ami,7 11 Rue Saint Benoit 6th arr 75006 Paris France
France,Paris,H tel Belloy Saint Germain By Happyculture,2 Rue Racine 6th arr 75006 Paris France
France,Paris,H tel Brighton Esprit de France,218 rue de Rivoli 1st arr 75001 Paris France
France,Paris,H tel California Champs Elys es,16 rue de Berri 8th arr 75008 Paris France
France,Paris,H tel Chaplain Paris Rive Gauche,11 Bis Rue Jules Chaplain 6th arr 75006 Paris France
France,Paris,H tel D Aubusson,33 Rue Dauphine 6th arr 75006 Paris France
France,Paris,H tel Da Vinci Spa,25 rue des Saints P res 6th arr 75006 Paris France
France,Paris,H tel De Castiglione,38 Rue Du Faubourg Saint Honore 8th arr 75008 Paris France
France,Paris,H tel De Vend me,1 Place Vend me 1st arr 75001 Paris France
France,Paris,H tel Diva Opera,11 rue de Tr vise 9th arr 75009 Paris France
France,Paris,H tel Duo,11 Rue Du Temple 4th arr 75004 Paris France
France,Paris,H tel Gustave,34 Rue Viala 15th arr 75015 Paris France
France,Paris,H tel Hor,160 Rue La Fayette 10th arr 75010 Paris France
France,Paris,H tel Horset Op ra Best Western Premier Collection,18 Rue d Antin 2nd arr 75002 Paris France
France,Paris,H tel Juliana Paris,10 12 rue Cognacq Jay 7th arr 75007 Paris France
France,Paris,H tel Keppler,10 Rue Kepler 16th arr 75016 Paris France
France,Paris,H tel Le Bellechasse Saint Germain,8 Rue De Bellechasse 7th arr 75007 Paris France
France,Paris,H tel Le M,20 bis rue de la Ga t 14th arr 75014 Paris France
France,Paris,H tel Le Marianne,11 rue Paul Baudry 8th arr 75008 Paris France
France,Paris,H tel Le Walt,37 Avenue De La Motte Picquet 7th arr 75007 Paris France
France,Paris,H tel Madison by MH,143 Boulevard Saint Germain 6th arr 75006 Paris France
France,Paris,H tel Mathis Elys es,3 rue de Ponthieu 8th arr 75008 Paris France
France,Paris,H tel Mayfair Paris,3 Rue Rouget De Lisle 1st arr 75001 Paris France
France,Paris,H tel Moli re,21 rue Moli re 1st arr 75001 Paris France
France,Paris,H tel Pont Royal,5 7 Rue De Montalembert 7th arr 75007 Paris France
France,Paris,H tel Powers,52 rue Francois 1er 8th arr 75008 Paris France
France,Paris,H tel R de Paris Boutique Hotel,41 rue de Clichy 9th arr 75009 Paris France
France,Paris,H tel Raphael,17 Avenue Kl ber 16th arr 75016 Paris France
France,Paris,H tel Regent s Garden,6 Rue Pierre Demours 17th arr 75017 Paris France
France,Paris,H tel Regina,2 place des Pyramides 1st arr 75001 Paris France
France,Paris,H tel Saint Marc,36 Rue Saint Marc 2nd arr 75002 Paris France
France,Paris,H tel San R gis,12 Rue Jean Goujon 8th arr 75008 Paris France
France,Paris,H tel Square Louvois,12 Rue de Louvois 2nd arr 75002 Paris France
France,Paris,H tel Victor Hugo Paris Kl ber,19 Rue Copernic 16th arr 75016 Paris France
France,Paris,H tel Westminster,13 Rue De La Paix 2nd arr 75002 Paris France
France,Paris,H tel de Banville,166 Boulevard Berthier 17th arr 75017 Paris France
France,Paris,H tel de Jos phine BONAPARTE,10 rue d Ormesson 4th arr 75004 Paris France
France,Paris,H tel de Lille,40 rue de Lille 7th arr 75007 Paris France
France,Paris,H tel de Varenne,44 rue de Bourgogne 7th arr 75007 Paris France
France,Paris,H tel de la Bourdonnais,111 avenue de la Bourdonnais 7th arr 75007 Paris France
France,Paris,H tel des Champs Elys es,2 Rue d Artois 8th arr 75008 Paris France
France,Paris,H tel des Ducs D Anjou,1 Rue Sainte Opportune 1st arr 75001 Paris France
France,Paris,H tel du Minist re,31 Rue de Surene 8th arr 75008 Paris France
France,Paris,Holiday Inn Paris Elys es,24 Rue De Miromesnil 8th arr 75008 Paris France
France,Paris,Holiday Inn Paris Gare Montparnasse,79 81 avenue du Maine 14th arr 75014 Paris France
France,Paris,Holiday Inn Paris Gare de Lyon Bastille,11 15 Rue De Lyon 12th arr 75012 Paris France
France,Paris,Holiday Inn Paris Gare de l Est,5 rue du 8 Mai 1945 10th arr 75010 Paris France
France,Paris,Holiday Inn Paris Op ra Grands Boulevards,30 32 Boulevard Poissonni re 9th arr 75009 Paris France
France,Paris,Hotel Ares Eiffel,7 rue du G n ral de Larminat 15th arr 75015 Paris France
France,Paris,Hotel Astor Saint Honor ,11 Rue d Astorg 8th arr 75008 Paris France
France,Paris,Hotel Atmospheres,29 31 rue des Ecoles 5th arr 75005 Paris France
France,Paris,Hotel Bachaumont,18 rue Bachaumont 2nd arr 75002 Paris France
France,Paris,Hotel Champs Elys es Friedland by Happyculture,177 rue du faubourg Saint Honor 8th arr 75008 Paris France
France,Paris,Hotel Claridge Paris,37 rue Fran ois 1er 8th arr 75008 Paris France
France,Paris,Hotel Des Saints Peres Esprit de France,65 rue des Saints P res 6th arr 75006 Paris France
France,Paris,Hotel Design Secret de Paris,2 Rue De Parme 9th arr 75009 Paris France
France,Paris,Hotel Duminy Vendome,3 5 rue du Mont Thabor 1st arr 75001 Paris France
France,Paris,Hotel Elys es Bassano,24 rue Bassano 16th arr 75016 Paris France
France,Paris,Hotel Eug ne en Ville,6 rue Buffault 9th arr 75009 Paris France
France,Paris,Hotel Georgette,36 rue du Grenier Saint Lazare 3rd arr 75003 Paris France
France,Paris,Hotel Indigo Paris Opera,2 Rue Edouard VII 9th arr 75009 Paris France
France,Paris,Hotel L Antoine,10 12 rue de Charonne 11th arr 75011 Paris France
France,Paris,Hotel La Lanterne,12 rue de la Montagne Sainte Genevi ve 5th arr 75005 Paris France
France,Paris,Hotel Le 10 BIS,10 Bis rue du D barcad re 17th arr 75017 Paris France
France,Paris,Hotel Le Chat Noir,68 Boulevard De Clichy 18th arr 75018 Paris France
France,Paris,Hotel Le Mareuil,51 Rue de Malte 11th arr 75011 Paris France
France,Paris,Hotel Le Placide Saint Germain Des Pr s,6 Rue Saint Placide 6th arr 75006 Paris France
France,Paris,Hotel Le Sainte Beuve,9 Rue Sainte Beuve 6th arr 75006 Paris France
France,Paris,Hotel Le Squara,3 rue Lepic 18th arr 75018 Paris France
France,Paris,Hotel Le petit Paris,214 rue Saint Jacques 5th arr 75005 Paris France
France,Paris,Hotel Les Rives de Notre Dame,15 Quai Saint Michel 5th arr 75005 Paris France
France,Paris,Hotel Les Th tres,98 Rue De Clery 2nd arr 75002 Paris France
France,Paris,Hotel Louvre Montana,12 rue Saint Roch 1st arr 75001 Paris France
France,Paris,Hotel Lumen Paris Louvre,15 Rue Des Pyramides 1st arr 75001 Paris France
France,Paris,Hotel Maison Ath n e,19 Rue De Caumartin 9th arr 75009 Paris France
France,Paris,Hotel Maison FL,6 Rue De La Tour 16th arr 75016 Paris France
France,Paris,Hotel Marignan Champs Elys es,12 rue de Marignan 8th arr 75008 Paris France
France,Paris,Hotel Mercure La Sorbonne Saint Germain des Pr s,14 Rue de la Sorbonne 5th arr 75005 Paris France
France,Paris,Hotel Montaigne,6 Avenue Montaigne 8th arr 75008 Paris France
France,Paris,Hotel Odeon Saint Germain,13 rue Saint Sulpice 6th arr 75006 Paris France
France,Paris,Hotel Op ra Richepanse,14 Rue du Chevalier de Saint George 1st arr 75001 Paris France
France,Paris,Hotel Opera Cadet,24 rue Cadet 9th arr 75009 Paris France
France,Paris,Hotel Panache,1 rue Geoffroy Marie 9th arr 75009 Paris France
France,Paris,Hotel Parc Saint Severin Esprit de France,22 Rue de La Parcheminerie 5th arr 75005 Paris France
France,Paris,Hotel Park Lane Paris,4 Rue La Boetie 8th arr 75008 Paris France
France,Paris,Hotel Plaza Elys es,177 Boulevard Haussmann 8th arr 75008 Paris France
France,Paris,Hotel Pulitzer Paris,23 rue du Faubourg Montmartre 9th arr 75009 Paris France
France,Paris,Hotel Royal Elys es,6 Avenue Victor Hugo 16th arr 75116 Paris France
France,Paris,Hotel Saint Petersbourg Opera,35 Rue Caumartin 9th arr 75009 Paris France
France,Paris,Hotel Scribe Paris Opera by Sofitel,1 Rue Scribe 9th arr 75009 Paris France
France,Paris,Hotel Stendhal Place Vend me Paris MGallery by Sofitel,22 Rue Danielle Casanova 1st arr 75002 Paris France
France,Paris,Hotel The Peninsula Paris,19 avenue Kleber 16th arr 75116 Paris France
France,Paris,Hotel Trianon Rive Gauche,1 Bis Rue De Vaugirard 6th arr 75006 Paris France
France,Paris,Hotel Vignon,23 Rue Vignon 8th arr 75008 Paris France
France,Paris,Hotel Villa Saxe Eiffel,9 Villa de Saxe 7th arr 75007 Paris France
France,Paris,Hotel West End,7 rue Cl ment Marot 8th arr 75008 Paris France
France,Paris,Hotel d Orsay Esprit de France,93 Rue de Lille 7th arr 75007 Paris France
France,Paris,Hotel de Seze,16 rue de S ze 9th arr 75009 Paris France
France,Paris,Hotel des Tuileries Relais du Silence,10 rue Saint Hyacinthe 1st arr 75001 Paris France
France,Paris,Hotel du Collectionneur Arc de Triomphe,51 57 rue de Courcelles 8th arr 75008 Paris France
France,Paris,Hotel du Louvre in the Unbound Collection by Hyatt,Place Andr Malraux 1st arr 75001 Paris France
France,Paris,Hotel du Petit Moulin,29 31 rue de Poitou 3rd arr 75003 Paris France
France,Paris,Hotel le Lapin Blanc,41 boulevard Saint Michel 5th arr 75005 Paris France
France,Paris,Hyatt Regency Paris Etoile,3 Place du G n ral Koenig 17th arr 75017 Paris France
France,Paris,Idol Hotel,16 rue d Edimbourg 8th arr 75008 Paris France
France,Paris,InterContinental Paris Le Grand,2 Rue Scribe 9th arr 75009 Paris France
France,Paris,K K H tel Cayr Saint Germain des Pr s,4 Boulevard Raspail 7th arr 75007 Paris France
France,Paris,L H tel,13 rue des Beaux Arts 6th arr 75006 Paris France
France,Paris,L Hotel Pergol se Paris,3 Rue Pergolese 16th arr 75116 Paris France
France,Paris,La Clef Tour Eiffel,83 avenue Kl ber 16th arr 75016 Paris France
France,Paris,La Maison Favart,5 Rue Marivaux 2nd arr 75002 Paris France
France,Paris,La Tremoille Paris,14 rue de la Tremoille 8th arr 75008 Paris France
France,Paris,La Villa Maillot,143 Avenue De Malakoff 16th arr 75016 Paris France
France,Paris,La Villa Royale,2 Rue Duperr 9th arr 75009 Paris France
France,Paris,La Villa des Ternes,97 avenue des Ternes 17th arr 75017 Paris France
France,Paris,Le 123 Elysees Astotel,123 Rue Du Faubourg Saint Honor 8th arr 75008 Paris France
France,Paris,Le 7 Eiffel Hotel,17 bis rue Am lie 7th arr 75007 Paris France
France,Paris,Le Burgundy Paris,6 8 Rue Duphot 1st arr 75001 Paris France
France,Paris,Le Cinq Codet,5 rue Louis Codet 7th arr 75007 Paris France
France,Paris,Le Dokhan s a Tribute Portfolio Hotel,117 Rue Lauriston 16th arr 75116 Paris France
France,Paris,Le Grand H tel de Normandie,4 rue Amsterdam 9th arr 75009 Paris France
France,Paris,Le Grey Hotel,12 rue de Parme 9th arr 75009 Paris France
France,Paris,Le M ridien Etoile,81 boulevard Gouvion Saint Cyr 17th arr 75017 Paris France
France,Paris,Le Marceau Bastille,13 Rue Jules Cesar 12th arr 75012 Paris France
France,Paris,Le Marquis Eiffel,15 Rue Dupleix 15th arr 75015 Paris France
France,Paris,Le Metropolitan a Tribute Portfolio Hotel,10 Place De Mexico 16th arr 75016 Paris France
France,Paris,Le Narcisse Blanc Spa,19 Boulevard De La Tour Maubourg 7th arr 75007 Paris France
France,Paris,Le Parisis Paris Tour Eiffel,102 Bd De Grenelle 15th arr 75015 Paris France
France,Paris,Le Pavillon de la Reine Spa,28 place des Vosges 3rd arr 75003 Paris France
France,Paris,Le Roch Hotel Spa,28 rue Saint Roch 1st arr 75001 Paris France
France,Paris,Le Senat,10 rue de Vaugirard 6th arr 75006 Paris France
France,Paris,Le Tourville Eiffel,16 avenue de Tourville 7th arr 75007 Paris France
France,Paris,Legend Saint Germain by Elegancia,151 bis Rue de Rennes 6th arr 75006 Paris France
France,Paris,Les Jardins Du Marais,74 rue Amelot 11th arr 75011 Paris France
France,Paris,Les Matins de Paris Spa,3 rue Clauzel 9th arr 75009 Paris France
France,Paris,Les Plumes Hotel,10 rue Lamartine 9th arr 75009 Paris France
France,Paris,Little Palace Hotel,4 rue Salomon de Caus 3rd arr 75003 Paris France
France,Paris,Madeleine Plaza,33 place de la Madeleine 8th arr 75008 Paris France
France,Paris,Maison Albar H tel Paris Champs Elys es ex Mac Mahon ,3 avenue Mac Mahon 17th arr 75017 Paris France
France,Paris,Maison Souquet,10 rue de Bruxelles 9th arr 75009 Paris France
France,Paris,Majestic Hotel Spa,30 Rue La P rouse 16th arr 75016 Paris France
